Date,Time,Platform,Asset_Type,Post_Text,Link,Notes
2026-08-31,08:00 CT,LinkedIn (Personal),Short hook,"Two charter schools, same size, same town. One mails its stop-loss premium off forever. The other gets a check back at year-end with its own name on it. Same plan underneath. One difference: [LINK]",[HUB_URL],Link in first comment recommended
2026-09-02,08:00 CT,LinkedIn (Newsletter),Newsletter,"Two charter schools, same size, same town. One mails its premium off forever. The other gets a check back with its own name on it. (Full newsletter, see linkedin-newsletter.md)",[HUB_URL],Publish as LinkedIn newsletter issue
2026-09-02,08:00 CT,LinkedIn (Personal),Short hook,Your broker says a captive is too advanced for a school your size. The companies that built this model open it to employers as small as 25 lives. The runway exists. He just never built it: [LINK],[HUB_URL],Link in first comment recommended
2026-09-04,08:00 CT,LinkedIn (Personal),Short hook,"Anybody who sells you a captive as guaranteed savings is lying to you. It is real risk moved onto your school. Here is the honest downside, and the three things that have to be true before you touch one: [LINK]",[HUB_URL],Link in first comment recommended
2026-09-07,08:00 CT,LinkedIn (Company),Checklist,"A group medical captive is the funding endgame for the right charter school. It is also real risk on your balance sheet. Here is how to tell where your school belongs, and what has to be true before you move. (Matrix + checklist, see company-page-checklist.md)",[HUB_URL],Post from company page; consider PDF lead-capture version
2026-09-07,08:00 CT,LinkedIn (Personal),Short hook,"Day one in a captive is reckless. The right path is level-funded first, captive as the goal. One proves your numbers. The other is the endgame. Here is the runway: [LINK]",[HUB_URL],Link in first comment recommended
2026-09-09,08:00 CT,LinkedIn (Personal),Short hook,"When your self-funded plan has a healthy year, where does the surplus go? With a carrier, it stays a carrier's profit. With a member-owned captive, it comes back to you, plus the interest it earned: [LINK]",[HUB_URL],Link in first comment recommended
2026-09-11,08:00 CT,LinkedIn (Personal),Short hook,Three things that decide whether a captive saves you money or costs you more: A tight plan document. An independent pass-through PBM. Real cost controls. Skip them and the pool overspends your dollars: [LINK],[HUB_URL],Link in first comment recommended
2026-09-14,08:00 CT,LinkedIn (Personal),NEPQ question,"One question for whoever runs your benefits: Has anyone ever laid out a multi-year path, level-funded first, then a captive, and shown you the upside AND the honest downside in dollars? Or has every renewal just been a bigger number? [LINK]",[HUB_URL],Closes the campaign on the NEPQ question
