Date,Time,Platform,Asset_Type,Post_Text,Link,Notes
2026-11-02,08:00 CT,LinkedIn (Personal),Short hook,"You told your broker you hired an attorney. Their answer was a quote for a brand new policy. That reflex, reaching for a separate policy the second they hear ""lawyer,"" is the tell. Here is what it tells you about your account: [LINK]",[HUB_URL],Link in first comment recommended
2026-11-03,08:00 CT,LinkedIn (Newsletter),Newsletter,"You hired in-house counsel. Your broker tried to sell you a whole new policy. That was the wrong move. (Full newsletter, see linkedin-newsletter.md)",[HUB_URL],Publish as LinkedIn newsletter issue
2026-11-04,08:00 CT,LinkedIn (Personal),Short hook,"A standalone Employed Lawyers policy means a second premium, a second renewal, a second set of terms. For a charter network, it usually insures a risk your management liability program already picks up. Before you agree to pay twice, read this: [LINK]",[HUB_URL],Link in first comment recommended
2026-11-05,08:00 CT,LinkedIn (Company),Checklist,"Brought legal counsel in-house? The coverage belongs inside the management liability program you already carry, not in a standalone policy a generalist wants to bolt on. (Checklist + matrix, see company-page-checklist.md)",[HUB_URL],Post from company page; consider PDF lead-capture version
2026-11-06,08:00 CT,LinkedIn (Personal),Short hook,"Your in-house counsel reviews contracts, reads the charter, advises the board. That is advisory work for one client, the employer who signs the paycheck. They are not running a litigation practice with a badge on. Why that distinction decides your coverage: [LINK]",[HUB_URL],Link in first comment recommended
2026-11-09,08:00 CT,LinkedIn (Personal),Short hook,"A broker hears ""we brought counsel in-house"" and reaches for a fresh standalone quote. You just learned two things. They did not read what you already own. They did not think about what your attorney actually does. Here is the rest of it: [LINK]",[HUB_URL],Link in first comment recommended
2026-11-11,08:00 CT,LinkedIn (Personal),Short hook,"The carriers that actually write for schools fold employed lawyers coverage into your management liability definition, or add it by endorsement for little or nothing. One program. One renewal. One carrier who understands the account. That is the answer a generalist skips right over: [LINK]",[HUB_URL],Link in first comment recommended
2026-11-13,08:00 CT,LinkedIn (Personal),Short hook,"Yes, your general liability form excludes legal malpractice. Yes, a generic D&O form can leave your staff attorneys out of the grant of coverage. The exposure is real. The fix is not a second policy. Here is where the coverage actually belongs: [LINK]",[HUB_URL],Link in first comment recommended
2026-11-16,08:00 CT,LinkedIn (Personal),NEPQ question,"One question for whoever handles your network's insurance. When you told them you brought an attorney on staff, did they confirm your existing program already covers your lawyer's work and show you the language, or did they reach for a separate policy and a separate premium? If you are not sure which answer you got, read this: [LINK]",[HUB_URL],Closes the campaign on the NEPQ question
